{
  "schemaVersion": 1,
  "refreshedAt": "2026-08-19T06:48:56Z",
  "household": {
    "adults": 2,
    "universityStudentsAtHome": 1,
    "secondaryStudents": 1,
    "notes": "Two adults, one public-university student living at home, and one public-secondary-school student."
  },
  "cities": [
    {
      "id": "javea",
      "name": "Jávea / Xàbia",
      "country": "Spain",
      "currency": "EUR",
      "locale": "es-ES",
      "sources": [
        {
          "id": "idealista-javea",
          "name": "Idealista — Jávea rentals",
          "url": "https://www.idealista.com/en/alquiler-viviendas/javeaxabia-alicante/con-pisos/",
          "reliability": "medium-high",
          "observationDate": "2026-08-19",
          "retrievedAt": "2026-08-19T06:48:56Z",
          "staleAfterDays": 45,
          "notes": "Large listing set; asking rents and seasonal leases can distort the market. This is a property portal, not an official statistic."
        },
        {
          "id": "welove-xabia",
          "name": "We Love Xàbia 2026 guide",
          "url": "https://welovexabia.com/news/javea-expat-guide-2026",
          "reliability": "medium",
          "observationDate": "2026-08-19",
          "retrievedAt": "2026-08-19T06:48:56Z",
          "staleAfterDays": 120,
          "notes": "Locally specific guide, but methodology and sample size are not published."
        },
        {
          "id": "numbeo-javea",
          "name": "Numbeo — Jávea",
          "url": "https://www.numbeo.com/cost-of-living/in/Javea-Xabia-Spain",
          "reliability": "medium-low",
          "observationDate": "2026-08-19",
          "retrievedAt": "2026-08-19T06:48:56Z",
          "staleAfterDays": 90,
          "notes": "Crowd-sourced observations with an uncertain local sample; not an official estimate."
        },
        {
          "id": "gva-fees",
          "name": "Generalitat Valenciana public-university fees",
          "url": "https://universitats.gva.es/es/decret-preus-publics",
          "reliability": "high",
          "observationDate": "2026-08-19",
          "retrievedAt": "2026-08-19T06:48:56Z",
          "staleAfterDays": 365,
          "notes": "Official legal source for public-university prices."
        },
        {
          "id": "ua-calculator",
          "name": "University of Alicante tuition calculator",
          "url": "https://web.ua.es/en/simulador-importe-matricula/tuition-fee-calculator.html",
          "reliability": "high",
          "observationDate": "2026-08-19",
          "retrievedAt": "2026-08-19T06:48:56Z",
          "staleAfterDays": 365,
          "notes": "Official calculator; exact tuition depends on degree, credits, and exemptions."
        },
        {
          "id": "javea-planner-assumption",
          "name": "Planner adopted assumption — Jávea",
          "url": "https://github.com/lucabol/family-cost-planner/blob/main/data/costs.v1.json",
          "reliability": "planning-assumption",
          "observationDate": "2026-08-19",
          "retrievedAt": "2026-08-19T06:48:56Z",
          "staleAfterDays": 365,
          "notes": "Explicit planning placeholder where no standardized external figure was available."
        }
      ],
      "items": [
        {
          "id": "housing",
          "label": "Three-bedroom rent",
          "defaultMonthly": 1300,
          "notes": "A central planning value within the portal range; seasonal inventory can be materially higher.",
          "evidence": [
            {
              "sourceId": "idealista-javea",
              "original": { "unit": "monthly", "currency": "EUR", "value": "€1,100–€1,500" },
              "monthlyNormalized": { "min": 1100, "max": 1500 },
              "includedInDefault": true,
              "overlaps": [],
              "notes": "Asking-rent range used as the primary default basis."
            },
            {
              "sourceId": "welove-xabia",
              "original": { "unit": "monthly", "currency": "EUR", "value": "Villa: €1,800–€3,500" },
              "monthlyNormalized": { "min": 1800, "max": 3500 },
              "includedInDefault": false,
              "overlaps": [],
              "notes": "Villa guide retained as context but excluded from the adopted apartment-style default."
            }
          ]
        },
        {
          "id": "utilities-internet",
          "label": "Utilities + internet",
          "defaultMonthly": 200,
          "notes": "Editable midpoint-style allowance.",
          "evidence": [
            {
              "sourceId": "welove-xabia",
              "original": { "unit": "monthly", "currency": "EUR", "value": "€150–€250" },
              "monthlyNormalized": { "min": 150, "max": 250 },
              "includedInDefault": true,
              "overlaps": [],
              "notes": "Local guide range."
            }
          ]
        },
        {
          "id": "food",
          "label": "Food for four",
          "defaultMonthly": 850,
          "notes": "Household food only; no university living allowance is added separately.",
          "evidence": [
            {
              "sourceId": "welove-xabia",
              "original": { "unit": "monthly", "currency": "EUR", "value": "€693–€1,039" },
              "monthlyNormalized": { "min": 693, "max": 1039 },
              "includedInDefault": true,
              "overlaps": [],
              "notes": "Local guide range adopted for a four-person household."
            }
          ]
        },
        {
          "id": "transport",
          "label": "Transport / car",
          "defaultMonthly": 250,
          "notes": "Local transport and car allowance.",
          "evidence": [
            {
              "sourceId": "numbeo-javea",
              "original": { "unit": "monthly", "currency": "EUR", "value": "€150–€250" },
              "monthlyNormalized": { "min": 150, "max": 250 },
              "includedInDefault": true,
              "overlaps": [],
              "notes": "Crowd-sourced range; the upper bound is adopted."
            }
          ]
        },
        {
          "id": "healthcare",
          "label": "Healthcare",
          "defaultMonthly": 150,
          "notes": "Private-cover planning allowance; eligible residents may use the public system.",
          "evidence": [
            {
              "sourceId": "numbeo-javea",
              "original": { "unit": "monthly", "currency": "EUR", "value": "Private cover: €120–€300" },
              "monthlyNormalized": { "min": 120, "max": 300 },
              "includedInDefault": true,
              "overlaps": [],
              "notes": "Non-official private-cover estimate."
            }
          ]
        },
        {
          "id": "university-tuition",
          "label": "Public university tuition",
          "defaultMonthly": 113,
          "notes": "Annual public tuition normalized monthly; degree and exemptions change the exact amount.",
          "evidence": [
            {
              "sourceId": "gva-fees",
              "original": { "unit": "annual", "currency": "EUR", "value": "€900–€1,800/year" },
              "monthlyNormalized": { "min": 75, "max": 150 },
              "includedInDefault": true,
              "overlaps": [],
              "notes": "Official public-price range normalized over 12 months."
            },
            {
              "sourceId": "ua-calculator",
              "original": { "unit": "qualitative", "currency": "EUR", "value": "Course-specific official calculator" },
              "monthlyNormalized": { "value": 113 },
              "includedInDefault": false,
              "overlaps": [],
              "notes": "Use the calculator for an exact course load; the planner retains the adopted midpoint."
            }
          ]
        },
        {
          "id": "university-books",
          "label": "University books",
          "defaultMonthly": 55,
          "notes": "No standardized local figure was found.",
          "evidence": [
            {
              "sourceId": "javea-planner-assumption",
              "original": { "unit": "monthly", "currency": "EUR", "value": "€55 adopted assumption" },
              "monthlyNormalized": { "value": 55 },
              "includedInDefault": true,
              "overlaps": [],
              "notes": "Clearly labeled planning placeholder."
            }
          ]
        },
        {
          "id": "secondary-school",
          "label": "Public secondary school",
          "defaultMonthly": 32,
          "notes": "Public tuition excluded; allowance covers supplies and incidental costs, not meals.",
          "evidence": [
            {
              "sourceId": "javea-planner-assumption",
              "original": { "unit": "annual", "currency": "EUR", "value": "€250–€500/year excluding meals" },
              "monthlyNormalized": { "min": 20.83, "max": 41.67 },
              "includedInDefault": true,
              "overlaps": [],
              "notes": "Prototype planning range normalized over 12 months."
            }
          ]
        },
        {
          "id": "other-household",
          "label": "Other household costs",
          "defaultMonthly": 500,
          "notes": "Clothing, household goods, and irregular essentials.",
          "evidence": [
            {
              "sourceId": "javea-planner-assumption",
              "original": { "unit": "monthly", "currency": "EUR", "value": "€500 adopted assumption" },
              "monthlyNormalized": { "value": 500 },
              "includedInDefault": true,
              "overlaps": [],
              "notes": "Editable planning placeholder rather than an observed market statistic."
            }
          ]
        }
      ]
    },
    {
      "id": "savona",
      "name": "Savona",
      "country": "Italy",
      "currency": "EUR",
      "locale": "it-IT",
      "sources": [
        {
          "id": "immobiliare-savona",
          "name": "Immobiliare.it — Savona",